{
  "descriptor_schema": "mission-control.runtime-descriptor/1",
  "component": "mission_control_runtime",
  "schema": "mission_control_runtime",
  "role": "mission_control_checkpointer",
  "pins": {
    "langgraph": "1.2.10",
    "langgraph-checkpoint": "4.1.1",
    "langgraph-checkpoint-postgres": "3.1.1",
    "psycopg": "3.3.4"
  },
  "vendor_sources_sha256": {
    "langgraph/checkpoint/postgres/base.py": "435424725ce05366ea3671efaed9a7c15f2b4a100205daaa96845723912ef112",
    "langgraph/checkpoint/postgres/aio.py": "31bf96bd0f55aed1e2e811e94a74cf7a404d130de4bf61f6752399d8563f7aab",
    "langgraph/store/postgres/base.py": "b9722a5c119f126528b50550250b8497a25a17b63b934be242ad18a4741e1878",
    "langgraph/store/postgres/aio.py": "a0362f730898e615f6101537c6be0fefc6dcea2a45883ac9717a89e5daf8e57c"
  },
  "session": {
    "search_path": "mission_control_runtime, pg_temp",
    "runtime_libpq_options": "-c search_path=mission_control_runtime,pg_temp",
    "advisory_lock_sql": "SELECT pg_catalog.pg_advisory_lock(pg_catalog.hashtextextended('mission_control_runtime.provision', 0))",
    "advisory_unlock_sql": "SELECT pg_catalog.pg_advisory_unlock(pg_catalog.hashtextextended('mission_control_runtime.provision', 0))",
    "lock_timeout": "5s"
  },
  "steps": [
    {
      "id": "prerequisite.schema_role",
      "kind": "sql",
      "transactional": true,
      "concurrent": false,
      "sql": "DO $role$\nDECLARE\n    existing record;\nBEGIN\n    SELECT oid, rolsuper, rolbypassrls, rolcanlogin, rolcreaterole, rolcreatedb, rolreplication\n      INTO existing FROM pg_catalog.pg_roles WHERE rolname = 'mission_control_checkpointer';\n    IF FOUND THEN\n        IF existing.rolsuper OR existing.rolbypassrls OR existing.rolcanlogin\n           OR existing.rolcreaterole OR existing.rolcreatedb OR existing.rolreplication THEN\n            RAISE EXCEPTION 'existing role mission_control_checkpointer is not a restricted NOLOGIN role';\n        END IF;\n        IF EXISTS (SELECT 1 FROM pg_catalog.pg_auth_members m WHERE m.member = existing.oid) THEN\n            RAISE EXCEPTION 'existing role mission_control_checkpointer holds role memberships';\n        END IF;\n    ELSE\n        CREATE ROLE mission_control_checkpointer NOLOGIN NOSUPERUSER NOBYPASSRLS NOCREATEDB NOCREATEROLE\n            NOINHERIT NOREPLICATION;\n    END IF;\nEND\n$role$;\nCREATE SCHEMA mission_control_runtime;\nREVOKE ALL ON SCHEMA mission_control_runtime FROM PUBLIC;\nREVOKE ALL ON SCHEMA mission_control_runtime FROM mission_control_checkpointer;\nGRANT USAGE ON SCHEMA mission_control_runtime TO mission_control_checkpointer;\n",
      "sha256": "74ff2240976abcccfc8246a2ba5daf63655cc0b55966a0ed5ef234d7700c40e8",
      "records_version": null,
      "precheck": [
        "SELECT pg_catalog.to_regnamespace('mission_control_runtime') IS NULL"
      ],
      "verify": [
        "SELECT n.nspowner = (SELECT r.oid FROM pg_catalog.pg_roles r WHERE r.rolname = current_user) FROM pg_catalog.pg_namespace n WHERE n.nspname = 'mission_control_runtime'",
        "SELECT NOT (r.rolsuper OR r.rolbypassrls OR r.rolcanlogin OR r.rolcreaterole OR r.rolcreatedb OR r.rolreplication) FROM pg_catalog.pg_roles r WHERE r.rolname = 'mission_control_checkpointer'",
        "SELECT NOT EXISTS (SELECT 1 FROM pg_catalog.pg_auth_members m JOIN pg_catalog.pg_roles r ON r.oid = m.member WHERE r.rolname = 'mission_control_checkpointer')",
        "SELECT pg_catalog.has_schema_privilege('mission_control_checkpointer', 'mission_control_runtime', 'USAGE') AND NOT pg_catalog.has_schema_privilege('mission_control_checkpointer', 'mission_control_runtime', 'CREATE')",
        "SELECT NOT EXISTS (SELECT 1 FROM pg_catalog.pg_namespace n CROSS JOIN LATERAL pg_catalog.aclexplode(n.nspacl) acl WHERE n.nspname = 'mission_control_runtime' AND acl.grantee = 0)",
        "SELECT NOT EXISTS (SELECT 1 FROM pg_catalog.pg_namespace n WHERE n.nspname IN ('mission_control', 'mission_control_search') AND (pg_catalog.has_schema_privilege('mission_control_checkpointer', n.oid, 'USAGE') OR pg_catalog.has_schema_privilege('mission_control_checkpointer', n.oid, 'CREATE')))"
      ],
      "verify_recorded": []
    },
    {
      "id": "saver.v0",
      "kind": "vendor",
      "transactional": true,
      "concurrent": false,
      "sql": "CREATE TABLE IF NOT EXISTS checkpoint_migrations (\n    v INTEGER PRIMARY KEY\n);",
      "sha256": "ce7cab847fabee5cf941b9fd0444d10d66cd3cf87eb53b10776e218f9cf318a1",
      "records_version": {
        "table": "checkpoint_migrations",
        "v": 0,
        "sql": "INSERT INTO mission_control_runtime.checkpoint_migrations (v) VALUES (0)"
      },
      "precheck": [
        "SELECT pg_catalog.current_schema() = 'mission_control_runtime'"
      ],
      "verify": [
        "SELECT pg_catalog.to_regclass('mission_control_runtime.checkpoint_migrations') IS NOT NULL AND (SELECT c.relkind = 'r' FROM pg_catalog.pg_class c WHERE c.oid = pg_catalog.to_regclass('mission_control_runtime.checkpoint_migrations'))",
        "SELECT pg_catalog.count(*) = 1 FROM pg_catalog.pg_attribute a WHERE a.attrelid = pg_catalog.to_regclass('mission_control_runtime.checkpoint_migrations') AND a.attnum > 0 AND NOT a.attisdropped AND (a.attname::text, pg_catalog.format_type(a.atttypid, a.atttypmod), a.attnotnull) IN (VALUES ('v', 'integer', true))",
        "SELECT EXISTS (SELECT 1 FROM pg_catalog.pg_index i JOIN pg_catalog.pg_class c ON c.oid = i.indexrelid JOIN pg_catalog.pg_namespace n ON n.oid = c.relnamespace WHERE n.nspname = 'mission_control_runtime' AND c.relname = 'checkpoint_migrations_pkey' AND i.indrelid = pg_catalog.to_regclass('mission_control_runtime.checkpoint_migrations') AND i.indisvalid AND i.indisready)"
      ],
      "verify_recorded": [
        "SELECT EXISTS (SELECT 1 FROM mission_control_runtime.checkpoint_migrations WHERE v = 0)"
      ]
    },
    {
      "id": "saver.v1",
      "kind": "vendor",
      "transactional": true,
      "concurrent": false,
      "sql": "CREATE TABLE IF NOT EXISTS checkpoints (\n    thread_id TEXT NOT NULL,\n    checkpoint_ns TEXT NOT NULL DEFAULT '',\n    checkpoint_id TEXT NOT NULL,\n    parent_checkpoint_id TEXT,\n    type TEXT,\n    checkpoint JSONB NOT NULL,\n    metadata JSONB NOT NULL DEFAULT '{}',\n    PRIMARY KEY (thread_id, checkpoint_ns, checkpoint_id)\n);",
      "sha256": "99cdcac4b487dff1b05eece6225f3434fade396355495a0a34b0ae813da5a12c",
      "records_version": {
        "table": "checkpoint_migrations",
        "v": 1,
        "sql": "INSERT INTO mission_control_runtime.checkpoint_migrations (v) VALUES (1)"
      },
      "precheck": [
        "SELECT pg_catalog.current_schema() = 'mission_control_runtime'"
      ],
      "verify": [
        "SELECT pg_catalog.to_regclass('mission_control_runtime.checkpoints') IS NOT NULL AND (SELECT c.relkind = 'r' FROM pg_catalog.pg_class c WHERE c.oid = pg_catalog.to_regclass('mission_control_runtime.checkpoints'))",
        "SELECT pg_catalog.count(*) = 7 FROM pg_catalog.pg_attribute a WHERE a.attrelid = pg_catalog.to_regclass('mission_control_runtime.checkpoints') AND a.attnum > 0 AND NOT a.attisdropped AND (a.attname::text, pg_catalog.format_type(a.atttypid, a.atttypmod), a.attnotnull) IN (VALUES ('thread_id', 'text', true), ('checkpoint_ns', 'text', true), ('checkpoint_id', 'text', true), ('parent_checkpoint_id', 'text', false), ('type', 'text', false), ('checkpoint', 'jsonb', true), ('metadata', 'jsonb', true))",
        "SELECT EXISTS (SELECT 1 FROM pg_catalog.pg_index i JOIN pg_catalog.pg_class c ON c.oid = i.indexrelid JOIN pg_catalog.pg_namespace n ON n.oid = c.relnamespace WHERE n.nspname = 'mission_control_runtime' AND c.relname = 'checkpoints_pkey' AND i.indrelid = pg_catalog.to_regclass('mission_control_runtime.checkpoints') AND i.indisvalid AND i.indisready)"
      ],
      "verify_recorded": [
        "SELECT EXISTS (SELECT 1 FROM mission_control_runtime.checkpoint_migrations WHERE v = 1)"
      ]
    },
    {
      "id": "saver.v2",
      "kind": "vendor",
      "transactional": true,
      "concurrent": false,
      "sql": "CREATE TABLE IF NOT EXISTS checkpoint_blobs (\n    thread_id TEXT NOT NULL,\n    checkpoint_ns TEXT NOT NULL DEFAULT '',\n    channel TEXT NOT NULL,\n    version TEXT NOT NULL,\n    type TEXT NOT NULL,\n    blob BYTEA,\n    PRIMARY KEY (thread_id, checkpoint_ns, channel, version)\n);",
      "sha256": "bcfa850d8ef40fc86930c1fd07d703383f78971c63ec4378866ef7a3516ee75d",
      "records_version": {
        "table": "checkpoint_migrations",
        "v": 2,
        "sql": "INSERT INTO mission_control_runtime.checkpoint_migrations (v) VALUES (2)"
      },
      "precheck": [
        "SELECT pg_catalog.current_schema() = 'mission_control_runtime'"
      ],
      "verify": [
        "SELECT pg_catalog.to_regclass('mission_control_runtime.checkpoint_blobs') IS NOT NULL AND (SELECT c.relkind = 'r' FROM pg_catalog.pg_class c WHERE c.oid = pg_catalog.to_regclass('mission_control_runtime.checkpoint_blobs'))",
        "SELECT pg_catalog.count(*) = 6 FROM pg_catalog.pg_attribute a WHERE a.attrelid = pg_catalog.to_regclass('mission_control_runtime.checkpoint_blobs') AND a.attnum > 0 AND NOT a.attisdropped AND (a.attname::text, pg_catalog.format_type(a.atttypid, a.atttypmod), a.attnotnull) IN (VALUES ('thread_id', 'text', true), ('checkpoint_ns', 'text', true), ('channel', 'text', true), ('version', 'text', true), ('type', 'text', true), ('blob', 'bytea', false))",
        "SELECT EXISTS (SELECT 1 FROM pg_catalog.pg_index i JOIN pg_catalog.pg_class c ON c.oid = i.indexrelid JOIN pg_catalog.pg_namespace n ON n.oid = c.relnamespace WHERE n.nspname = 'mission_control_runtime' AND c.relname = 'checkpoint_blobs_pkey' AND i.indrelid = pg_catalog.to_regclass('mission_control_runtime.checkpoint_blobs') AND i.indisvalid AND i.indisready)"
      ],
      "verify_recorded": [
        "SELECT EXISTS (SELECT 1 FROM mission_control_runtime.checkpoint_migrations WHERE v = 2)"
      ]
    },
    {